{"access":{"class":"public","export_policy":"full","owner_project":null,"permitted_principals":[]},"access_details":{"access_limitations":[],"accessed_at":"2026-07-15T00:30:00+00:00","license":"Synthetic fixture; no copyrighted full text.","storage_status":"metadata_only"},"aliases":[{"type":"preferred_name","value":"Synthetic W2 catalyst-method article"}],"anchors":[{"anchor_id":"fixture_method_anchor","locator":"page 5, Computational Details","locator_type":"page","notes":["Synthetic locator for offline validation."],"object_sha256":null}],"bibliography":{"article_number":null,"authors":["A. Fixture","B. Reviewer"],"doi":"10.5555/auto.g16.fixture","editors":[],"isbn":null,"issn":"0000-0000","issue":"1","journal":"Journal of Offline Fixtures","page_range":"1-10","publisher":"Synthetic Fixture Press","stable_url":"https://example.invalid/fixture-article","title":"A synthetic catalyst and computational protocol fixture","volume":"1","year":2026},"blockers":[],"calculation_ready":false,"claims":[{"anchor_ids":["fixture_method_anchor"],"category":"computational_method","claim_id":"fixture_method_claim","review_status":"reviewed","statement_type":"paraphrase","text":"The synthetic source reports a complete closed-shell optimization and frequency protocol."}],"contradictions":[],"created_at":"2026-07-15T00:00:00+00:00","created_by":"fixture_author","external_identifiers":[{"scheme":"DOI","value":"10.5555/auto.g16.fixture"}],"no_submission_authorization":true,"objects":[],"payload_sha256":"f2f0e6ab8605b1174026a008fb8291bd881d3254730b1f0381775bbe52d4fd15","provenance":{"importer":null,"source_artifacts":[],"source_kind":"manual_review"},"record_id":"fixture_article","review":{"notes":["Synthetic bibliographic fixture."],"reviewed_at":"2026-07-15T01:00:00+00:00","reviewer":"fixture_reviewer","status":"reviewed"},"revision_id":"fixture_article_r001","schema":"auto-g16-source-record/1","source_type":"journal_article","uncertainties":[],"version":{"chapter":null,"edition":null,"language":"en","version_label":"version_of_record"}}
