{"access":{"class":"group_internal","export_policy":"metadata_redacted","owner_project":null,"permitted_principals":[]},"access_details":{"access_limitations":["No book content is stored or redistributed."],"accessed_at":"2026-07-15T00:30:00+00:00","license":"Metadata-only synthetic fixture.","storage_status":"metadata_only"},"aliases":[{"type":"preferred_name","value":"Synthetic Computational Chemistry Handbook"}],"anchors":[{"anchor_id":"fixture_book_anchor","locator":"2nd edition, Chapter 5, page 108","locator_type":"page","notes":[],"object_sha256":null}],"bibliography":{"article_number":null,"authors":["C. Fixture"],"doi":null,"editors":["D. Editor"],"isbn":"9780000000002","issn":null,"issue":null,"journal":null,"page_range":"100-120","publisher":"Synthetic Fixture Press","stable_url":"https://example.invalid/fixture-book","title":"Synthetic Computational Chemistry Handbook","volume":null,"year":2026},"blockers":[],"calculation_ready":false,"claims":[{"anchor_ids":["fixture_book_anchor"],"category":"protocol_reporting","claim_id":"fixture_book_claim","review_status":"reviewed","statement_type":"paraphrase","text":"The synthetic chapter describes why full protocol metadata must be retained."}],"contradictions":[],"created_at":"2026-07-15T00:00:00+00:00","created_by":"fixture_author","external_identifiers":[{"scheme":"ISBN","value":"9780000000002"}],"no_submission_authorization":true,"objects":[],"payload_sha256":"c71c416370604086b8ae685166a154a40e9cf6af1ae1c89ee77d5ab98f2a9fed","provenance":{"importer":null,"source_artifacts":[],"source_kind":"manual_review"},"record_id":"fixture_book","review":{"notes":["Synthetic book fixture with edition and page anchor."],"reviewed_at":"2026-07-15T01:00:00+00:00","reviewer":"fixture_reviewer","status":"reviewed"},"revision_id":"fixture_book_r001","schema":"auto-g16-source-record/1","source_type":"book_chapter","uncertainties":[],"version":{"chapter":"Chapter 5: Reproducible Protocols","edition":"2nd edition","language":"en","version_label":null}}
